<animal xsi:noNamespaceSchemaLocation="file:/home/doyenm/Documents/Projets/zoo/zoo/src/zoo/animal/specie/resourceSpecie/model.xsd">
    <names>
        <fr>Emeu australien</fr>
        <en>Emu</en>
        <scientific>Dromaius novaehollandiae</scientific>
    </names>
    <reproduction>
        <femaleMaturity>19</femaleMaturity>
        <maleMaturity>19</maleMaturity>
        <gestationFrequency>1</gestationFrequency>
        <litterSize>10</litterSize>
    </reproduction>
    <lifespan>
        <femaleLifespan>84</femaleLifespan>
        <maleLifeSpan>84</maleLifeSpan>
    </lifespan>
</animal>
