<?xml version="1.0" encoding="UTF-8"?>
<!--
To change this license header, choose License Headers in Project Properties.
To change this template file, choose Tools | Templates
and open the template in the editor.
-->


<animal
    xmlns:xsi='http://www.w3.org/2001/XMLSchema-instance'
    xsi:noNamespaceSchemaLocation='file:/home/doyenm/Documents/Projets/zoo/zoo/src/zoo/animal/specie/resourceSpecie/model.xsd'>
    <names>
        <fr>Toucan toco</fr>
       <en>Toco toucan</en>
        <scientific>Ramphastos toco</scientific>
    </names>
    <reproduction>
        <femaleMaturity>42</femaleMaturity>
        <maleMaturity>42</maleMaturity>
        <gestationFrequency>1</gestationFrequency>
        <litterSize>3</litterSize>
    </reproduction>
    <lifespan>
        <femaleLifespan>256</femaleLifespan>
        <maleLifeSpan>256</maleLifeSpan>
    </lifespan>

</animal>
