<animal xsi:noNamespaceSchemaLocation="file:/home/doyenm/Documents/Projets/zoo/zoo/src/zoo/animal/specie/resourceSpecie/model.xsd">
    <names>
        <fr>Chimpanz√© commun</fr>
        <en>Chimpanze</en>
        <scientific>Pan troglodytes</scientific>
    </names>
    <reproduction>
        <femaleMaturity>78</femaleMaturity>
        <maleMaturity>78</maleMaturity>
        <gestationFrequency>???</gestationFrequency>
        <litterSize>1</litterSize>
    </reproduction>
    <lifespan>
        <femaleLifespan>600</femaleLifespan>
        <maleLifeSpan>600</maleLifeSpan>
    </lifespan>
</animal>