<animal xsi:noNamespaceSchemaLocation="file:/home/doyenm/Documents/Projets/zoo/zoo/src/zoo/animal/specie/resourceSpecie/model.xsd">
    <names>
        <fr>Bonobo</fr>
        <en>Bonobo</en>
        <scientific>Pan satyrus paniscus</scientific>
    </names>
    <reproduction>
        <femaleMaturity>168</femaleMaturity>
        <maleMaturity>168</maleMaturity>
        <gestationFrequency>0.2</gestationFrequency>
        <litterSize>1</litterSize>
    </reproduction>
    <lifespan>
        <femaleLifespan>240</femaleLifespan>
        <maleLifeSpan>240</maleLifeSpan>
    </lifespan>
</animal>