<?xml version="1.0" encoding="UTF-8"?>
<!--
To change this license header, choose License Headers in Project Properties.
To change this template file, choose Tools | Templates
and open the template in the editor.
-->


<animal
    xmlns:xsi='http://www.w3.org/2001/XMLSchema-instance'
    xsi:noNamespaceSchemaLocation='file:/home/doyenm/Documents/Projets/zoo/zoo/src/zoo/animal/specie/resourceSpecie/model.xsd'>
    <names>
        <fr>Flamand rose du Chili</fr>
       <en>Chilean flamingo</en>
        <scientific>Phoenicopterus chilensis</scientific>
    </names>
    <reproduction>
        <femaleMaturity>72</femaleMaturity>
        <maleMaturity>72</maleMaturity>
        <gestationFrequency>0.75</gestationFrequency>
        <litterSize>1</litterSize>
    </reproduction>
    <lifespan>
        <femaleLifespan>540</femaleLifespan>
        <maleLifeSpan>540</maleLifeSpan>
    </lifespan>

</animal>
