<?xml version="1.0" encoding="UTF-8"?>
<animal
    xmlns:xsi='http://www.w3.org/2001/XMLSchema-instance'
    xsi:noNamespaceSchemaLocation='file:/home/doyenm/Documents/Projets/zoo/zoo/src/zoo/animal/specie/resourceSpecie/model.xsd'>
    <names>
        <fr>Kangourou bleu</fr>
        <en>Blue kangoroo</en>
        <scientific>Macropus rufus</scientific>
    </names>
    <reproduction>
        <femaleMaturity>1</femaleMaturity>
        <maleMaturity>2</maleMaturity>
        <gestationFrequency>3.0</gestationFrequency>
        <litterSize>4</litterSize>
    </reproduction>
    <lifespan>
        <femaleLifespan>5</femaleLifespan>
        <maleLifeSpan>6</maleLifeSpan>
    </lifespan>
</animal>
