<animal xsi:noNamespaceSchemaLocation="file:/home/doyenm/Documents/Projets/zoo/zoo/src/zoo/animal/specie/resourceSpecie/model.xsd">
    <names>
        <fr>Ours blanc</fr>
        <en>Polar bear</en>
        <scientific>Ursus maritimus</scientific>
    </names>
    <reproduction>
        <femaleMaturity>66</femaleMaturity>
        <maleMaturity>66</maleMaturity>
        <gestationFrequency>1</gestationFrequency>
        <litterSize>2</litterSize>
    </reproduction>
    <lifespan>
        <femaleLifespan>330</femaleLifespan>
        <maleLifeSpan>330</maleLifeSpan>
    </lifespan>
</animal>