<animal xsi:noNamespaceSchemaLocation="file:/home/doyenm/Documents/Projets/zoo/zoo/src/zoo/animal/specie/resourceSpecie/model.xsd">
    <names>
        <fr>Loutre d'Asie</fr>
        <en>Smooth-coated otter</en>
        <scientific>Lutrogale perspicillata</scientific>
    </names>
    <reproduction>
        <femaleMaturity>24</femaleMaturity>
        <maleMaturity>24</maleMaturity>
        <gestationFrequency>1</gestationFrequency>
        <litterSize>5</litterSize>
    </reproduction>
    <lifespan>
        <femaleLifespan>84</femaleLifespan>
        <maleLifeSpan>84</maleLifeSpan>
    </lifespan>
</animal>
