<animal xsi:noNamespaceSchemaLocation="file:/home/doyenm/Documents/Projets/zoo/zoo/src/zoo/animal/specie/resourceSpecie/model.xsd">
    <names>
        <fr>Serval</fr>
        <en>Serval</en>
        <scientific>Leptailurus serval</scientific>
    </names>
    <reproduction>
        <femaleMaturity>27</femaleMaturity>
        <maleMaturity>???</maleMaturity>
        <gestationFrequency>1</gestationFrequency>
        <litterSize>3</litterSize>
    </reproduction>
    <lifespan>
        <femaleLifespan>120</femaleLifespan>
        <maleLifeSpan>120</maleLifeSpan>
    </lifespan>
</animal>
