<animal xsi:noNamespaceSchemaLocation="file:/home/doyenm/Documents/Projets/zoo/zoo/src/zoo/animal/specie/resourceSpecie/model.xsd">
    <names>
        <fr>Vari roux</fr>
        <en>Red ruffed lemur</en>
        <scientific>Varecia rubra</scientific>
    </names>
    <reproduction>
        <femaleMaturity>24</femaleMaturity>
        <maleMaturity>???</maleMaturity>
        <gestationFrequency>1</gestationFrequency>
        <litterSize>3</litterSize>
    </reproduction>
    <lifespan>
        <femaleLifespan>240</femaleLifespan>
        <maleLifeSpan>240</maleLifeSpan>
    </lifespan>
</animal>
